{
  "$schema": "http://json-schema.org/draft-07/schema#",
  "title": "TokenLineEvent",
  "type": "object",
  "properties": {
    "event_id": {
      "type": "string"
    },
    "event_type": {
      "type": "string",
      "enum": [
        "token_issued",
        "token_used",
        "token_refreshed",
        "token_revoked",
        "token_expired",
        "logout",
        "refresh_reuse_detected",
        "suspicious_location",
        "suspicious_device",
        "replay_detected"
      ]
    },
    "time": {
      "type": "string",
      "format": "date-time"
    },
    "user_id": {
      "type": "string"
    },
    "token_hash": {
      "type": "string"
    },
    "token_family": {
      "type": "string"
    },
    "parent_token_hash": {
      "type": "string"
    },
    "ip_hash": {
      "type": "string"
    },
    "country": {
      "type": "string",
      "pattern": "^[A-Z]{2}$"
    },
    "device_id": {
      "type": "string"
    },
    "user_agent_family": {
      "type": "string"
    },
    "endpoint": {
      "type": "string"
    },
    "result": {
      "type": "string",
      "enum": [
        "accepted",
        "rejected"
      ]
    }
  },
  "required": [
    "event_id",
    "event_type",
    "time",
    "user_id",
    "token_hash",
    "ip_hash",
    "device_id",
    "result"
  ],
  "additionalProperties": false
}
