[
  {
    "event_id": "evt-normal-001",
    "event_type": "token_issued",
    "time": "2026-08-16T10:00:00Z",
    "user_id": "user-synthetic-normal",
    "token_hash": "hash_a51dd1f0ff5c",
    "ip_hash": "hash_8f00f2fc86d2",
    "device_id": "device-workstation-normal",
    "result": "accepted",
    "token_family": "family-normal-42",
    "country": "US",
    "user_agent_family": "Chrome",
    "endpoint": "/api/auth/login"
  },
  {
    "event_id": "evt-normal-002",
    "event_type": "token_used",
    "time": "2026-08-16T10:02:00Z",
    "user_id": "user-synthetic-normal",
    "token_hash": "hash_a51dd1f0ff5c",
    "ip_hash": "hash_8f00f2fc86d2",
    "device_id": "device-workstation-normal",
    "result": "accepted",
    "token_family": "family-normal-42",
    "country": "US",
    "user_agent_family": "Chrome",
    "endpoint": "/api/v1/profile"
  },
  {
    "event_id": "evt-normal-003",
    "event_type": "token_used",
    "time": "2026-08-16T10:05:00Z",
    "user_id": "user-synthetic-normal",
    "token_hash": "hash_a51dd1f0ff5c",
    "ip_hash": "hash_8f00f2fc86d2",
    "device_id": "device-workstation-normal",
    "result": "accepted",
    "token_family": "family-normal-42",
    "country": "US",
    "user_agent_family": "Chrome",
    "endpoint": "/api/v1/dashboard"
  },
  {
    "event_id": "evt-normal-004",
    "event_type": "token_refreshed",
    "time": "2026-08-16T10:30:00Z",
    "user_id": "user-synthetic-normal",
    "token_hash": "hash_307eaa20d7cb",
    "ip_hash": "hash_8f00f2fc86d2",
    "device_id": "device-workstation-normal",
    "result": "accepted",
    "token_family": "family-normal-42",
    "parent_token_hash": "hash_a51dd1f0ff5c",
    "country": "US",
    "user_agent_family": "Chrome",
    "endpoint": "/api/auth/refresh"
  },
  {
    "event_id": "evt-normal-005",
    "event_type": "token_used",
    "time": "2026-08-16T10:33:20Z",
    "user_id": "user-synthetic-normal",
    "token_hash": "hash_307eaa20d7cb",
    "ip_hash": "hash_8f00f2fc86d2",
    "device_id": "device-workstation-normal",
    "result": "accepted",
    "token_family": "family-normal-42",
    "country": "US",
    "user_agent_family": "Chrome",
    "endpoint": "/api/v1/feed"
  },
  {
    "event_id": "evt-normal-006",
    "event_type": "logout",
    "time": "2026-08-16T11:00:00Z",
    "user_id": "user-synthetic-normal",
    "token_hash": "hash_307eaa20d7cb",
    "ip_hash": "hash_8f00f2fc86d2",
    "device_id": "device-workstation-normal",
    "result": "accepted",
    "token_family": "family-normal-42",
    "country": "US",
    "user_agent_family": "Chrome",
    "endpoint": "/api/auth/logout"
  }
]