[
  {
    "event_id": "evt-replay-001",
    "event_type": "token_issued",
    "time": "2026-08-16T10:00:00Z",
    "user_id": "user-synthetic-01",
    "token_hash": "hash_6a438e0305c7",
    "ip_hash": "hash_18ac8b418b9c",
    "device_id": "device-legit-laptop",
    "result": "accepted",
    "token_family": "family-replay-42",
    "country": "US",
    "user_agent_family": "Chrome",
    "endpoint": "/api/auth/login"
  },
  {
    "event_id": "evt-replay-002",
    "event_type": "token_used",
    "time": "2026-08-16T10:02:00Z",
    "user_id": "user-synthetic-01",
    "token_hash": "hash_6a438e0305c7",
    "ip_hash": "hash_18ac8b418b9c",
    "device_id": "device-legit-laptop",
    "result": "accepted",
    "token_family": "family-replay-42",
    "country": "US",
    "user_agent_family": "Chrome",
    "endpoint": "/api/v1/profile"
  },
  {
    "event_id": "evt-replay-003",
    "event_type": "token_used",
    "time": "2026-08-16T10:04:00Z",
    "user_id": "user-synthetic-01",
    "token_hash": "hash_6a438e0305c7",
    "ip_hash": "hash_18ac8b418b9c",
    "device_id": "device-legit-laptop",
    "result": "accepted",
    "token_family": "family-replay-42",
    "country": "US",
    "user_agent_family": "Chrome",
    "endpoint": "/api/v1/dashboard"
  },
  {
    "event_id": "evt-replay-004",
    "event_type": "replay_detected",
    "time": "2026-08-16T10:05:00Z",
    "user_id": "user-synthetic-01",
    "token_hash": "hash_6a438e0305c7",
    "ip_hash": "hash_f74d055116b4",
    "device_id": "device-unknown-adversary",
    "result": "rejected",
    "token_family": "family-replay-42",
    "country": "RO",
    "user_agent_family": "Python-requests",
    "endpoint": "/api/v1/wallet"
  },
  {
    "event_id": "evt-reuse-001",
    "event_type": "token_issued",
    "time": "2026-08-16T10:00:00Z",
    "user_id": "user-synthetic-02",
    "token_hash": "hash_8f8a7544c420",
    "ip_hash": "hash_eaee36a39e9a",
    "device_id": "device-user-phone",
    "result": "accepted",
    "token_family": "family-refresh-42",
    "country": "US",
    "user_agent_family": "MobileSafari",
    "endpoint": "/api/auth/login"
  },
  {
    "event_id": "evt-reuse-002",
    "event_type": "token_used",
    "time": "2026-08-16T10:05:00Z",
    "user_id": "user-synthetic-02",
    "token_hash": "hash_8f8a7544c420",
    "ip_hash": "hash_eaee36a39e9a",
    "device_id": "device-user-phone",
    "result": "accepted",
    "token_family": "family-refresh-42",
    "country": "US",
    "user_agent_family": "MobileSafari",
    "endpoint": "/api/v1/feed"
  },
  {
    "event_id": "evt-reuse-003",
    "event_type": "token_refreshed",
    "time": "2026-08-16T10:30:00Z",
    "user_id": "user-synthetic-02",
    "token_hash": "hash_2358bd5b54a9",
    "ip_hash": "hash_eaee36a39e9a",
    "device_id": "device-user-phone",
    "result": "accepted",
    "token_family": "family-refresh-42",
    "parent_token_hash": "hash_8f8a7544c420",
    "country": "US",
    "user_agent_family": "MobileSafari",
    "endpoint": "/api/auth/refresh"
  },
  {
    "event_id": "evt-reuse-004",
    "event_type": "token_used",
    "time": "2026-08-16T10:33:20Z",
    "user_id": "user-synthetic-02",
    "token_hash": "hash_2358bd5b54a9",
    "ip_hash": "hash_eaee36a39e9a",
    "device_id": "device-user-phone",
    "result": "accepted",
    "token_family": "family-refresh-42",
    "country": "US",
    "user_agent_family": "MobileSafari",
    "endpoint": "/api/v1/feed"
  },
  {
    "event_id": "evt-reuse-005",
    "event_type": "token_refreshed",
    "time": "2026-08-16T10:35:00Z",
    "user_id": "user-synthetic-02",
    "token_hash": "hash_aecdb8c2adcc",
    "ip_hash": "hash_9686f21a661a",
    "device_id": "device-adversary-bot",
    "result": "rejected",
    "token_family": "family-refresh-42",
    "parent_token_hash": "hash_8f8a7544c420",
    "country": "RU",
    "user_agent_family": "Curl",
    "endpoint": "/api/auth/refresh"
  },
  {
    "event_id": "evt-logout-001",
    "event_type": "token_issued",
    "time": "2026-08-16T10:00:00Z",
    "user_id": "user-synthetic-03",
    "token_hash": "hash_19aa6e0d7451",
    "ip_hash": "hash_2f78c43c4879",
    "device_id": "device-workstation-01",
    "result": "accepted",
    "token_family": "family-logout-42",
    "country": "US",
    "user_agent_family": "Firefox",
    "endpoint": "/api/auth/login"
  },
  {
    "event_id": "evt-logout-002",
    "event_type": "token_used",
    "time": "2026-08-16T10:05:00Z",
    "user_id": "user-synthetic-03",
    "token_hash": "hash_19aa6e0d7451",
    "ip_hash": "hash_2f78c43c4879",
    "device_id": "device-workstation-01",
    "result": "accepted",
    "token_family": "family-logout-42",
    "country": "US",
    "user_agent_family": "Firefox",
    "endpoint": "/api/v1/projects"
  },
  {
    "event_id": "evt-logout-003",
    "event_type": "logout",
    "time": "2026-08-16T10:15:00Z",
    "user_id": "user-synthetic-03",
    "token_hash": "hash_19aa6e0d7451",
    "ip_hash": "hash_2f78c43c4879",
    "device_id": "device-workstation-01",
    "result": "accepted",
    "token_family": "family-logout-42",
    "country": "US",
    "user_agent_family": "Firefox",
    "endpoint": "/api/auth/logout"
  },
  {
    "event_id": "evt-logout-004",
    "event_type": "token_used",
    "time": "2026-08-16T10:16:00Z",
    "user_id": "user-synthetic-03",
    "token_hash": "hash_19aa6e0d7451",
    "ip_hash": "hash_2f78c43c4879",
    "device_id": "device-workstation-01",
    "result": "rejected",
    "token_family": "family-logout-42",
    "country": "US",
    "user_agent_family": "Firefox",
    "endpoint": "/api/v1/projects"
  },
  {
    "event_id": "evt-concurrent-001",
    "event_type": "token_issued",
    "time": "2026-08-16T10:00:00Z",
    "user_id": "user-synthetic-04",
    "token_hash": "hash_6a46517c1916",
    "ip_hash": "hash_56eff2b56a6b",
    "device_id": "device-workstation-office",
    "result": "accepted",
    "token_family": "family-concurrent-42",
    "country": "US",
    "user_agent_family": "Edge",
    "endpoint": "/api/auth/login"
  },
  {
    "event_id": "evt-concurrent-002",
    "event_type": "token_used",
    "time": "2026-08-16T10:01:00Z",
    "user_id": "user-synthetic-04",
    "token_hash": "hash_6a46517c1916",
    "ip_hash": "hash_56eff2b56a6b",
    "device_id": "device-workstation-office",
    "result": "accepted",
    "token_family": "family-concurrent-42",
    "country": "US",
    "user_agent_family": "Edge",
    "endpoint": "/api/v1/documents"
  },
  {
    "event_id": "evt-concurrent-003",
    "event_type": "token_used",
    "time": "2026-08-16T10:01:05Z",
    "user_id": "user-synthetic-04",
    "token_hash": "hash_6a46517c1916",
    "ip_hash": "hash_14116da75a8e",
    "device_id": "device-rogue-clone",
    "result": "accepted",
    "token_family": "family-concurrent-42",
    "country": "DE",
    "user_agent_family": "Go-http-client",
    "endpoint": "/api/v1/documents/export"
  },
  {
    "event_id": "evt-concurrent-004",
    "event_type": "suspicious_device",
    "time": "2026-08-16T10:01:10Z",
    "user_id": "user-synthetic-04",
    "token_hash": "hash_6a46517c1916",
    "ip_hash": "hash_14116da75a8e",
    "device_id": "device-rogue-clone",
    "result": "rejected",
    "token_family": "family-concurrent-42",
    "country": "DE",
    "user_agent_family": "Go-http-client",
    "endpoint": "/api/v1/documents/export"
  },
  {
    "event_id": "evt-travel-001",
    "event_type": "token_issued",
    "time": "2026-08-16T10:00:00Z",
    "user_id": "user-synthetic-05",
    "token_hash": "hash_9335e39804b0",
    "ip_hash": "hash_f34f6aa33970",
    "device_id": "device-traveler-laptop",
    "result": "accepted",
    "token_family": "family-travel-42",
    "country": "IN",
    "user_agent_family": "Chrome",
    "endpoint": "/api/auth/login"
  },
  {
    "event_id": "evt-travel-002",
    "event_type": "token_used",
    "time": "2026-08-16T10:01:00Z",
    "user_id": "user-synthetic-05",
    "token_hash": "hash_9335e39804b0",
    "ip_hash": "hash_f34f6aa33970",
    "device_id": "device-traveler-laptop",
    "result": "accepted",
    "token_family": "family-travel-42",
    "country": "IN",
    "user_agent_family": "Chrome",
    "endpoint": "/api/v1/profile"
  },
  {
    "event_id": "evt-travel-003",
    "event_type": "suspicious_location",
    "time": "2026-08-16T10:05:00Z",
    "user_id": "user-synthetic-05",
    "token_hash": "hash_9335e39804b0",
    "ip_hash": "hash_d9bd2b15e5cb",
    "device_id": "device-traveler-laptop",
    "result": "rejected",
    "token_family": "family-travel-42",
    "country": "US",
    "user_agent_family": "Chrome",
    "endpoint": "/api/v1/profile"
  }
]