[
  {
    "event_id": "evt-reuse-001",
    "event_type": "token_issued",
    "time": "2026-08-16T10:00:00Z",
    "user_id": "user-synthetic-02",
    "token_hash": "hash_8f8a7544c420",
    "ip_hash": "hash_eaee36a39e9a",
    "device_id": "device-user-phone",
    "result": "accepted",
    "token_family": "family-refresh-42",
    "country": "US",
    "user_agent_family": "MobileSafari",
    "endpoint": "/api/auth/login"
  },
  {
    "event_id": "evt-reuse-002",
    "event_type": "token_used",
    "time": "2026-08-16T10:05:00Z",
    "user_id": "user-synthetic-02",
    "token_hash": "hash_8f8a7544c420",
    "ip_hash": "hash_eaee36a39e9a",
    "device_id": "device-user-phone",
    "result": "accepted",
    "token_family": "family-refresh-42",
    "country": "US",
    "user_agent_family": "MobileSafari",
    "endpoint": "/api/v1/feed"
  },
  {
    "event_id": "evt-reuse-003",
    "event_type": "token_refreshed",
    "time": "2026-08-16T10:30:00Z",
    "user_id": "user-synthetic-02",
    "token_hash": "hash_2358bd5b54a9",
    "ip_hash": "hash_eaee36a39e9a",
    "device_id": "device-user-phone",
    "result": "accepted",
    "token_family": "family-refresh-42",
    "parent_token_hash": "hash_8f8a7544c420",
    "country": "US",
    "user_agent_family": "MobileSafari",
    "endpoint": "/api/auth/refresh"
  },
  {
    "event_id": "evt-reuse-004",
    "event_type": "token_used",
    "time": "2026-08-16T10:33:20Z",
    "user_id": "user-synthetic-02",
    "token_hash": "hash_2358bd5b54a9",
    "ip_hash": "hash_eaee36a39e9a",
    "device_id": "device-user-phone",
    "result": "accepted",
    "token_family": "family-refresh-42",
    "country": "US",
    "user_agent_family": "MobileSafari",
    "endpoint": "/api/v1/feed"
  },
  {
    "event_id": "evt-reuse-005",
    "event_type": "token_refreshed",
    "time": "2026-08-16T10:35:00Z",
    "user_id": "user-synthetic-02",
    "token_hash": "hash_aecdb8c2adcc",
    "ip_hash": "hash_9686f21a661a",
    "device_id": "device-adversary-bot",
    "result": "rejected",
    "token_family": "family-refresh-42",
    "parent_token_hash": "hash_8f8a7544c420",
    "country": "RU",
    "user_agent_family": "Curl",
    "endpoint": "/api/auth/refresh"
  }
]