[
  {
    "event_id": "evt-001",
    "event_type": "token_issued",
    "time": "2026-08-16T10:00:00Z",
    "user_id": "user-khushi",
    "token_hash": "token_hash_a1b2c3d4",
    "token_family": "family-khushi-1",
    "ip_hash": "ip_hash_home",
    "country": "IN",
    "device_id": "device-laptop-khushi",
    "user_agent_family": "Chrome",
    "endpoint": "/api/auth/login",
    "result": "accepted"
  },
  {
    "event_id": "evt-002",
    "event_type": "token_used",
    "time": "2026-08-16T10:05:00Z",
    "user_id": "user-khushi",
    "token_hash": "token_hash_a1b2c3d4",
    "token_family": "family-khushi-1",
    "ip_hash": "ip_hash_home",
    "country": "IN",
    "device_id": "device-laptop-khushi",
    "user_agent_family": "Chrome",
    "endpoint": "/api/v1/profile",
    "result": "accepted"
  },
  {
    "event_id": "evt-003",
    "event_type": "token_refreshed",
    "time": "2026-08-16T10:30:00Z",
    "user_id": "user-khushi",
    "token_hash": "token_hash_e5f6g7h8",
    "token_family": "family-khushi-1",
    "parent_token_hash": "token_hash_a1b2c3d4",
    "ip_hash": "ip_hash_home",
    "country": "IN",
    "device_id": "device-laptop-khushi",
    "user_agent_family": "Chrome",
    "endpoint": "/api/auth/refresh",
    "result": "accepted"
  },
  {
    "event_id": "evt-004",
    "event_type": "token_used",
    "time": "2026-08-16T10:35:00Z",
    "user_id": "user-khushi",
    "token_hash": "token_hash_e5f6g7h8",
    "token_family": "family-khushi-1",
    "ip_hash": "ip_hash_home",
    "country": "IN",
    "device_id": "device-laptop-khushi",
    "user_agent_family": "Chrome",
    "endpoint": "/api/v1/dashboard",
    "result": "accepted"
  },
  {
    "event_id": "evt-005",
    "event_type": "replay_detected",
    "time": "2026-08-16T10:36:00Z",
    "user_id": "user-khushi",
    "token_hash": "token_hash_a1b2c3d4",
    "token_family": "family-khushi-1",
    "ip_hash": "ip_hash_attacker",
    "country": "US",
    "device_id": "device-unknown-attacker",
    "user_agent_family": "Python-requests",
    "endpoint": "/api/v1/dashboard",
    "result": "rejected"
  },
  {
    "event_id": "evt-006",
    "event_type": "token_expired",
    "time": "2026-08-16T11:00:00Z",
    "user_id": "user-khushi",
    "token_hash": "token_hash_e5f6g7h8",
    "token_family": "family-khushi-1",
    "ip_hash": "ip_hash_home",
    "country": "IN",
    "device_id": "device-laptop-khushi",
    "user_agent_family": "Chrome",
    "endpoint": "/api/v1/dashboard",
    "result": "rejected"
  }
]
